{
  "schema_version": "1.0.0",
  "id": "rotate-array",
  "version": 2,
  "title": "회전 배열 최대 일치",
  "difficulty": "medium",
  "tags": ["permutation", "counting"],
  "supported_languages": ["python", "cpp"],
  "statement": {
    "summary": "한 순열을 회전해 다른 순열과 같은 위치의 값이 가장 많아지게 합니다.",
    "description": "1부터 N까지의 수가 한 번씩 등장하는 두 순열 A와 B가 주어집니다. A를 오른쪽으로 K칸 회전했을 때 A와 B의 같은 위치에 놓인 값의 최대 개수와, 이를 만드는 가장 작은 K를 출력하세요.",
    "input": "첫 줄에 N, 둘째 줄에 순열 A, 셋째 줄에 순열 B가 주어집니다.",
    "output": "최대 일치 개수와 그때의 가장 작은 회전 칸 수 K를 공백으로 구분해 출력합니다.",
    "constraints": ["1 <= N <= 200,000", "A와 B는 각각 1..N의 순열입니다.", "0 <= K < N"]
  },
  "examples": [
    {"input": "5\n1 2 3 4 5\n4 5 1 2 3\n", "output": "5 2\n", "explanation": "A를 오른쪽으로 2칸 회전하면 B와 완전히 같아집니다."},
    {"input": "4\n1 2 3 4\n1 3 2 4\n", "output": "2 0\n", "explanation": "회전하지 않을 때 값 1과 4가 같은 위치에 있습니다."}
  ],
  "modes": {
    "beginner": {"time_limit_seconds": 600, "answer_format": "pseudocode", "prompt": "각 값의 A 위치와 B 위치 차이로 필요한 오른쪽 회전량을 구하고 빈도를 세는 과정을 작성하세요."},
    "intermediate": {
      "time_limit_seconds": 840,
      "answer_format": "code",
      "skeletons": {
        "python": "n = int(input())\nfirst = list(map(int, input().split()))\nsecond = list(map(int, input().split()))\npositions = [0] * (n + 1)\n# TODO: 각 값이 일치하는 데 필요한 회전량의 빈도를 세세요.\n",
        "cpp": "#include <iostream>\n#include <vector>\nusing namespace std;\nint main() {\n    int n; cin >> n;\n    vector<int> first(n), position(n + 1), frequency(n);\n    for (int &value : first) cin >> value;\n    // TODO: 두 번째 순열의 위치와 비교해 회전량 빈도를 세세요.\n    return 0;\n}\n"
      }
    },
    "expert": {
      "time_limit_seconds": 1080,
      "answer_format": "code",
      "starter_templates": {
        "python": "def solve():\n    pass\n\nif __name__ == '__main__':\n    solve()\n",
        "cpp": "#include <iostream>\nusing namespace std;\nint main() {\n    ios::sync_with_stdio(false);\n    cin.tie(nullptr);\n    return 0;\n}\n"
      }
    }
  }
}
