{
  "schema_version": "1.0.0",
  "id": "hanoi-tower-moves",
  "version": 1,
  "title": "하노이 탑 이동 순서 출력",
  "difficulty": "easy",
  "tags": [
    "recursion",
    "simulation",
    "easy"
  ],
  "supported_languages": [
    "python",
    "cpp"
  ],
  "statement": {
    "summary": "하노이 탑을 해결하는 이동 순서를 출력합니다.",
    "description": "세 개의 기둥 A, B, C가 있을 때, A 기둥에 N개의 원판이 크기 순서대로 놓여 있다. 원판을 한 번에 하나씩만 옮길 수 있으며, 큰 원판 위에 작은 원판을 올려놓을 수 있다. 모든 원판을 A 기둥에서 C 기둥으로 옮기는 과정을 출력하라.\n\n각 이동은 \"출발 기둥 목적지 기둥\" 형태로 한 줄에 하나씩 출력한다. 예를 들어 A 기둥에서 B 기둥으로 원판을 옮긴다면 \"A B\"를 출력한다.",
    "input": "첫 번째 줄에 원판의 개수 N (1 ≤ N ≤ 10)이 주어진다.",
    "output": "원판을 옮기는 전체 과정을 한 줄에 하나씩 출력한다. 각 줄은 두 개의 문자와 공백으로 이루어져야 하며, 첫 번째 문자는 출발 기둥, 두 번째 문자는 목적지 기둥을 나타낸다.",
    "constraints": [
      "1 ≤ N ≤ 10",
      "기둥은 A, B, C 세 개만 사용한다."
    ]
  },
  "examples": [
    {
      "input": "2",
      "output": "A B\nA C\nB C",
      "explanation": "두 개의 원판을 옮기는 최적 순서는 위와 같다."
    },
    {
      "input": "3",
      "output": "A C\nA B\nC B\nA C\nB A\nB C\nA C",
      "explanation": "세 개의 원판을 옮기는 전체 7번의 이동 순서이다."
    }
  ],
  "modes": {
    "beginner": {
      "time_limit_seconds": 120,
      "answer_format": "pseudocode",
      "prompt": "재귀를 이용해 하노이 탑을 풀어보세요. 함수 hanoi(n, src, dst, aux, moves)를 구현하면 됩니다."
    },
    "intermediate": {
      "time_limit_seconds": 210,
      "answer_format": "code",
      "skeletons": {
        "python": "def hanoi(n, src, dst, aux, moves):\n    # TODO: 재귀적으로 이동 순서를 moves 리스트에 추가하세요\n    pass\n\ndef main():\n    import sys\n    n = int(sys.stdin.readline())\n    moves = []\n    hanoi(n, 'A', 'C', 'B', moves)\n    for a, b in moves:\n        print(a, b)\n\nif __name__ == \"__main__\":\n    main()",
        "cpp": "#include <iostream>\n#include <utility>\n#include <vector>\nusing namespace std;\n\nvoid hanoi(int n, char src, char dst, char aux, vector<pair<char,char>>& moves) {\n    // TODO: 재귀적으로 이동 순서를 moves에 추가하세요\n}\n\nint main() {\n    ios::sync_with_stdio(false);\n    cin.tie(nullptr);\n    int n; if(!(cin>>n)) return 0;\n    vector<pair<char,char>> moves;\n    hanoi(n, 'A', 'C', 'B', moves);\n    for(auto &p: moves) cout << p.first << ' ' << p.second << '\\n';\n    return 0;\n}"
      }
    },
    "expert": {
      "time_limit_seconds": 300,
      "answer_format": "code",
      "starter_templates": {
        "python": "import sys\n\ndef hanoi(n, src, dst, aux, moves):\n    if n == 0:\n        return\n    hanoi(n-1, src, aux, dst, moves)\n    moves.append((src, dst))\n    hanoi(n-1, aux, dst, src, moves)\n\n\ndef main():\n    n = int(sys.stdin.readline())\n    moves = []\n    hanoi(n, 'A', 'C', 'B', moves)\n    for a, b in moves:\n        print(a, b)\n\nif __name__ == \"__main__\":\n    main()",
        "cpp": "#include <iostream>\n#include <utility>\n#include <vector>\nusing namespace std;\n\nvoid hanoi(int n, char src, char dst, char aux, vector<pair<char,char>>& moves) {\n    if (n == 0) return;\n    hanoi(n-1, src, aux, dst, moves);\n    moves.emplace_back(src, dst);\n    hanoi(n-1, aux, dst, src, moves);\n}\n\nint main() {\n    ios::sync_with_stdio(false);\n    cin.tie(nullptr);\n    int n; if(!(cin>>n)) return 0;\n    vector<pair<char,char>> moves;\n    hanoi(n, 'A', 'C', 'B', moves);\n    for (auto &p : moves) {\n        cout << p.first << ' ' << p.second << '\\n';\n    }\n    return 0;\n}"
      }
    }
  }
}
