{
  "schema_version": "1.0.0",
  "id": "add-two-integers",
  "version": 1,
  "title": "두 정수 더하기",
  "difficulty": "easy",
  "tags": ["implementation", "arithmetic"],
  "supported_languages": ["python", "cpp"],
  "statement": {
    "summary": "두 정수의 합을 출력합니다.",
    "description": "공백으로 구분된 두 정수 A와 B를 입력받아 A+B를 출력하세요.",
    "input": "첫 줄에 두 정수 A와 B가 주어집니다.",
    "output": "A와 B의 합을 출력합니다.",
    "constraints": ["-1,000,000,000 <= A, B <= 1,000,000,000"]
  },
  "examples": [
    {"input": "2 3\n", "output": "5\n", "explanation": "2와 3의 합은 5입니다."},
    {"input": "-4 10\n", "output": "6\n", "explanation": "-4와 10의 합은 6입니다."}
  ],
  "modes": {
    "beginner": {
      "time_limit_seconds": 300,
      "answer_format": "pseudocode",
      "prompt": "입력, 덧셈, 출력의 순서가 드러나도록 의사코드를 작성하세요."
    },
    "intermediate": {
      "time_limit_seconds": 600,
      "answer_format": "code",
      "skeletons": {
        "python": "a, b = map(int, input().split())\n# TODO: 두 수의 합을 출력하세요.\n",
        "cpp": "#include <iostream>\nusing namespace std;\nint main() {\n    long long a, b;\n    cin >> a >> b;\n    // TODO: 두 수의 합을 출력하세요.\n    return 0;\n}\n"
      }
    },
    "expert": {
      "time_limit_seconds": 900,
      "answer_format": "code",
      "starter_templates": {
        "python": "def solve():\n    pass\n\nif __name__ == '__main__':\n    solve()\n",
        "cpp": "#include <iostream>\nusing namespace std;\nint main() {\n    ios::sync_with_stdio(false);\n    cin.tie(nullptr);\n    return 0;\n}\n"
      }
    }
  }
}
