{
  "schema_version": "1.0.0",
  "id": "balanced-brackets",
  "version": 2,
  "title": "와일드카드 괄호 문자열",
  "difficulty": "medium",
  "tags": ["greedy", "range"],
  "supported_languages": ["python", "cpp"],
  "statement": {
    "summary": "물음표를 괄호로 바꾸어 올바른 괄호 문자열을 만들 수 있는지 판별합니다.",
    "description": "문자열의 각 ?를 ( 또는 ) 중 하나로 바꿀 수 있습니다. 모든 ?를 바꾼 뒤 올바른 괄호 문자열을 만들 수 있으면 YES, 아니면 NO를 출력하세요.",
    "input": "첫 줄에 (, ), ?로 이루어진 문자열이 주어집니다.",
    "output": "올바른 괄호 문자열을 만들 수 있으면 YES, 아니면 NO를 출력합니다.",
    "constraints": ["1 <= 문자열 길이 <= 200,000", "각 ?는 반드시 ( 또는 )로 바꿔야 합니다."]
  },
  "examples": [
    {"input": "(?)?\n", "output": "YES\n", "explanation": "두 물음표를 각각 (와 )로 바꾸면 (())가 됩니다."},
    {"input": "?)(\n", "output": "NO\n", "explanation": "어떻게 바꾸어도 길이가 홀수이고 닫힘 순서를 만족할 수 없습니다."}
  ],
  "modes": {
    "beginner": {"time_limit_seconds": 600, "answer_format": "pseudocode", "prompt": "각 위치에서 가능한 열린 괄호 수의 최솟값과 최댓값을 함께 갱신하는 그리디 과정을 작성하세요."},
    "intermediate": {
      "time_limit_seconds": 840,
      "answer_format": "code",
      "skeletons": {
        "python": "brackets = input().strip()\nminimum_open = 0\nmaximum_open = 0\n# TODO: 가능한 열린 괄호 수의 범위를 갱신하세요.\n",
        "cpp": "#include <iostream>\n#include <string>\nusing namespace std;\nint main() {\n    string brackets; cin >> brackets;\n    int minimumOpen = 0, maximumOpen = 0;\n    // TODO: 가능한 열린 괄호 수의 범위를 갱신하세요.\n    return 0;\n}\n"
      }
    },
    "expert": {
      "time_limit_seconds": 1080,
      "answer_format": "code",
      "starter_templates": {
        "python": "def solve():\n    pass\n\nif __name__ == '__main__':\n    solve()\n",
        "cpp": "#include <iostream>\nusing namespace std;\nint main() {\n    ios::sync_with_stdio(false);\n    cin.tie(nullptr);\n    return 0;\n}\n"
      }
    }
  }
}
