{
  "schema_version": "1.0.0",
  "id": "valid-bracket-string",
  "version": 1,
  "title": "스택으로 올바른 괄호 판별",
  "difficulty": "medium",
  "tags": ["stack", "string"],
  "supported_languages": ["python", "cpp"],
  "statement": {
    "summary": "세 종류의 괄호가 올바르게 짝지어졌는지 판별합니다.",
    "description": "(), [], {}로 이루어진 문자열이 열고 닫는 순서와 종류가 모두 올바르면 YES, 아니면 NO를 출력하세요.",
    "input": "첫 줄에 괄호 문자열이 주어집니다.",
    "output": "올바른 괄호 문자열이면 YES, 아니면 NO를 출력합니다.",
    "constraints": ["1 <= 문자열 길이 <= 100,000", "문자열은 (, ), [, ], {, }로만 이루어집니다."]
  },
  "examples": [
    {"input": "()[]{}\n", "output": "YES\n", "explanation": "모든 괄호가 같은 종류끼리 올바르게 닫힙니다."},
    {"input": "([)]\n", "output": "NO\n", "explanation": "가장 안쪽의 [보다 )가 먼저 닫혀 순서가 잘못되었습니다."}
  ],
  "modes": {
    "beginner": {
      "time_limit_seconds": 300,
      "answer_format": "pseudocode",
      "prompt": "스택을 사용해 여는 괄호를 저장하고 닫는 괄호와 비교하는 과정을 의사코드로 작성하세요."
    },
    "intermediate": {
      "time_limit_seconds": 600,
      "answer_format": "code",
      "skeletons": {
        "python": "brackets = input().strip()\nstack = []\npairs = {')': '(', ']': '[', '}': '{'}\n# TODO: 괄호 문자열을 검사하세요.\n",
        "cpp": "#include <iostream>\n#include <stack>\n#include <string>\nusing namespace std;\nint main() {\n    string s; cin >> s;\n    stack<char> opened;\n    // TODO: 괄호 문자열을 검사하세요.\n    return 0;\n}\n"
      }
    },
    "expert": {
      "time_limit_seconds": 900,
      "answer_format": "code",
      "starter_templates": {
        "python": "def solve():\n    pass\n\nif __name__ == '__main__':\n    solve()\n",
        "cpp": "#include <iostream>\nusing namespace std;\nint main() {\n    ios::sync_with_stdio(false);\n    cin.tie(nullptr);\n    return 0;\n}\n"
      }
    }
  }
}
