{
  "schema_version": "1.0.0",
  "id": "shortest-path",
  "version": 2,
  "title": "할인 쿠폰 최단 경로",
  "difficulty": "hard",
  "tags": ["graph", "dijkstra", "state-space"],
  "supported_languages": ["python", "cpp"],
  "statement": {
    "summary": "간선 하나를 반값으로 이용할 수 있는 최단 경로를 구합니다.",
    "description": "양의 가중치를 가진 무방향 그래프에서 시작점부터 도착점까지 이동합니다. 경로 위 간선 하나에 쿠폰을 사용하면 그 간선 비용이 floor(w/2)가 됩니다. 쿠폰을 사용하지 않아도 됩니다. 가능한 최소 비용을 출력하세요.",
    "input": "첫 줄에 N, M, 시작 정점 S, 도착 정점 T가 주어집니다. 이어지는 M개 줄에 무방향 간선 u, v, w가 주어집니다.",
    "output": "쿠폰을 최대 한 번 사용했을 때의 최소 이동 비용을 출력합니다.",
    "constraints": ["1 <= N <= 100,000", "0 <= M <= 200,000", "1 <= w <= 1,000,000,000", "S에서 T로 가는 경로가 존재합니다."]
  },
  "examples": [
    {"input": "4 4 1 4\n1 2 3\n2 4 4\n1 3 10\n3 4 1\n", "output": "5\n", "explanation": "1-2-4 경로에서 비용 4인 간선에 쿠폰을 쓰면 3+2=5입니다."},
    {"input": "3 2 1 3\n1 2 5\n2 3 7\n", "output": "8\n", "explanation": "비용 7인 간선을 3으로 할인하면 총비용은 8입니다."}
  ],
  "modes": {
    "beginner": {"time_limit_seconds": 300, "answer_format": "pseudocode", "prompt": "정점뿐 아니라 쿠폰 사용 여부까지 상태로 둔 2차원 거리 배열과 다익스트라 완화를 작성하세요."},
    "intermediate": {
      "time_limit_seconds": 450,
      "answer_format": "code",
      "skeletons": {
        "python": "import heapq\n\nn, m, start, end = map(int, input().split())\ngraph = [[] for _ in range(n + 1)]\nfor _ in range(m):\n    u, v, w = map(int, input().split())\n    graph[u].append((v, w))\n    graph[v].append((u, w))\n# TODO: (정점, 쿠폰 사용 여부)를 상태로 다익스트라를 수행하세요.\n",
        "cpp": "#include <iostream>\n#include <queue>\n#include <vector>\nusing namespace std;\nint main() {\n    int n, m, start, destination; cin >> n >> m >> start >> destination;\n    vector<vector<pair<int, long long>>> graph(n + 1);\n    while (m--) { int u, v; long long w; cin >> u >> v >> w; graph[u].push_back({v, w}); graph[v].push_back({u, w}); }\n    // TODO: (정점, 쿠폰 사용 여부)를 상태로 다익스트라를 수행하세요.\n    return 0;\n}\n"
      }
    },
    "expert": {
      "time_limit_seconds": 600,
      "answer_format": "code",
      "starter_templates": {
        "python": "def solve():\n    pass\n\nif __name__ == '__main__':\n    solve()\n",
        "cpp": "#include <iostream>\nusing namespace std;\nint main() {\n    ios::sync_with_stdio(false);\n    cin.tie(nullptr);\n    return 0;\n}\n"
      }
    }
  }
}
