{
  "schema_version": "1.0.0",
  "id": "shortest-path-basic",
  "version": 1,
  "title": "기본 가중 그래프 최단 경로",
  "difficulty": "hard",
  "tags": ["graph", "dijkstra", "priority-queue"],
  "supported_languages": ["python", "cpp"],
  "statement": {
    "summary": "양의 가중치를 가진 무방향 그래프에서 최단 거리를 구합니다.",
    "description": "N개의 정점과 M개의 간선으로 이루어진 무방향 그래프가 주어질 때 시작 정점에서 도착 정점까지의 최단 거리를 출력하세요.",
    "input": "첫 줄에 N, M, 시작 정점, 도착 정점이 주어집니다. 이어지는 M개 줄에는 u, v, w가 주어지며 u와 v 사이의 가중치 w인 간선을 뜻합니다.",
    "output": "시작 정점에서 도착 정점까지의 최단 거리를 출력합니다.",
    "constraints": ["1 <= N <= 100,000", "0 <= M <= 200,000", "1 <= w <= 1,000,000", "시작 정점에서 도착 정점으로 가는 경로가 존재합니다."]
  },
  "examples": [
    {"input": "4 4 1 4\n1 2 3\n2 4 4\n1 3 10\n3 4 1\n", "output": "7\n", "explanation": "1-2-4 경로의 거리는 3+4=7로 가장 짧습니다."},
    {"input": "3 2 1 3\n1 2 5\n2 3 7\n", "output": "12\n", "explanation": "1-2-3 경로의 총거리는 12입니다."}
  ],
  "modes": {
    "beginner": {
      "time_limit_seconds": 300,
      "answer_format": "pseudocode",
      "prompt": "거리 배열과 우선순위 큐를 사용하는 다익스트라 알고리즘을 의사코드로 작성하세요."
    },
    "intermediate": {
      "time_limit_seconds": 600,
      "answer_format": "code",
      "skeletons": {
        "python": "import heapq\n\nn, m, start, end = map(int, input().split())\ngraph = [[] for _ in range(n + 1)]\nfor _ in range(m):\n    u, v, w = map(int, input().split())\n    graph[u].append((v, w))\n    graph[v].append((u, w))\n# TODO: 다익스트라 알고리즘으로 최단 거리를 구하세요.\n",
        "cpp": "#include <iostream>\n#include <queue>\n#include <vector>\nusing namespace std;\nint main() {\n    int n, m, start, destination; cin >> n >> m >> start >> destination;\n    vector<vector<pair<int, int>>> graph(n + 1);\n    while (m--) { int u, v, w; cin >> u >> v >> w; graph[u].push_back({v, w}); graph[v].push_back({u, w}); }\n    // TODO: 다익스트라 알고리즘으로 최단 거리를 구하세요.\n    return 0;\n}\n"
      }
    },
    "expert": {
      "time_limit_seconds": 900,
      "answer_format": "code",
      "starter_templates": {
        "python": "def solve():\n    pass\n\nif __name__ == '__main__':\n    solve()\n",
        "cpp": "#include <iostream>\nusing namespace std;\nint main() {\n    ios::sync_with_stdio(false);\n    cin.tie(nullptr);\n    return 0;\n}\n"
      }
    }
  }
}
